{
  "specversion":"1.0",
  "id":"evt_01K5H9NEXUS000000000002",
  "source":"https://nexus.moremarginco.com/modules/control-tower",
  "type":"nexus.control-tower.registry.reconciled.v1",
  "subject":"registry/phase-one",
  "time":"2026-09-19T12:00:00Z",
  "datacontenttype":"application/json",
  "scope":"system",
  "actortype":"operator",
  "actorid":"operator_nicolas",
  "dataclassification":"internal",
  "correlationid":"corr_124",
  "data":{"registry_version":"0.2.0"}
}
